MeasureCode,MeasureType,Source,ClinicalTitle,WebName,Description,Footnote,RateLabel,Nqf,NqfId,BetterHighLow,RaMethod,ScaleBy,ScaleTarget,NatBenchmark,PeerBenchmark,Numerator,Denominator,ObservedRate,IsIncludedInDomainScoring,SupportsCost,ConsumerDescription,ConsumerPlainTitle
PSI 16,QIvolume,AHRQ,Transfusion Reaction Volume,Number of patients who get a blood transfusion and have a problem or reaction to the blood they get,How often a patient in the hospital had a bad reaction to donated blood.,1,,Y,349,L,obsv,1,Provider,0,0,18,0,0,0,0,How often a patient in the hospital had a bad reaction to donated blood.,Number of patients who get a blood transfusion and have a problem or reaction to the blood they get
PSI 17,QIprovider,AHRQ,Birth Trauma - Injury to Neonate,How often newborns babies have an injury or get an infection during delivery,"How often a newborn infant experiences a problem during the birth process (labor or delivery) such as a broken collarbone, an infection, or a head injury.",1,,N,N/A,L,obsv,1000,Provider,0.00219,0,1767,805130,0.00219,0,0,"How often a newborn infant experiences a problem during the birth process (labor or delivery) such as a broken collarbone, an infection, or a head injury.",How often newborns babies have an injury or get an infection during delivery
PSI 18,QIprovider,AHRQ,Obstetric Trauma Rate - Vaginal Delivery With Instrument,How often women who give birth vaginally with forceps or vacuum have a serious vaginal tear,How often a woman experiences a tear (trauma) to her perineum - the area between her vagina and rectum - while giving birth when a health care provider is helping to deliver her baby using a forceps or other medical instrument. Such tears are often preventable.,1,,N,N/A,L,obsv,1000,Provider,0.14303,0,6129,42850,0.14303,0,0,How often a woman experiences a tear (trauma) to her perineum - the area between her vagina and rectum - while giving birth when a health care provider is helping to deliver her baby using a forceps or other medical instrument. Such tears are often preventable.,How often women who give birth vaginally with forceps or vacuum have a serious vaginal tear
PSI 19,QIprovider,AHRQ,Obstetric Trauma Rate - Vaginal Delivery Without Instrument,How often women who give birth vaginally without forceps or vacuum have a serious vaginal tear,"How often a woman experiences a tear (trauma) to her perineum - the area between her vagina and rectum - while giving birth. Such tears, which can happen even when medical instruments are not used, are often preventable.",1,,N,N/A,L,obsv,1000,Provider,0.02214,0,11128,502651,0.02214,0,0,"How often a woman experiences a tear (trauma) to her perineum - the area between her vagina and rectum - while giving birth. Such tears, which can happen even when medical instruments are not used, are often preventable.",How often women who give birth vaginally without forceps or vacuum have a serious vaginal tear
IQI 14_QNTY,CostQuality,Calculated,Number of hip replacement surgeries performed,Number of hip replacement surgeries performed,These numbers show the number of times a surgery was performed in each hospital.,1,,N,N/A,L,mcmc,100,Provider,0.0006,0,60,51369,0.0012,0,0,"These numbers show the number of times a surgery was performed in each hospital.  A higher number of surgeries at the hospital ofter means that a hospital provides better quality care.",Number of hip replacement surgeries performed
IQI 14_COST,CostQuality,Calculated,Average cost to the hospital for hip replacement surgery,Average cost to the hospital for hip replacement surgery,"These dollar amounts show the average cost to the hospital for a hip replecement surgery. A higher average cost to the hospital does not always mean a hospital provides better quality care. Your costs (what you pay yourself) will also depend on details of your surgery, and insurance coverage. Rememeber, higher cost do not always mean higher quality.",1,,N,N/A,L,mcmc,100,Provider,0.0006,0,60,51369,0.0012,0,0,"These dollar amounts show the average cost to the hospital for a hip replecement surgery. A higher average cost to the hospital does not always mean a hospital provides better quality care. Your costs (what you pay yourself) will also depend on details of your surgery, and insurance coverage. Rememeber, higher cost do not always mean higher quality.",Average cost to the hospital for hip replacement surgery
IQI 12_QNTY,CostQuality,Calculated,"Number of bypass a blocked blood vessel in the heart surgeries performed","Number of bypass a blocked blood vessel in the heart surgeries performed","These numbers show the number of times a surgery was performed in each hospital.",1,,N,N/A,L,mcmc,100,Provider,0.0006,0,60,51369,0.0012,0,0,"These numbers show the number of times a surgery to bypass a blocked blood vessel in the heart was performed in each hospital.  These numbers show the number of times a surgery was performed in each hospital.  A higher number of surgeries at the hospital often means that a hospital provides better quality care.",Number of blocked blood vessel bypass surgeries performed
IQI 12_COST,CostQuality,Calculated,Average cost to the hospital for having a surgery to bypass a blocked blood vessel in the heart,Average cost to the hospital for a surgery to bypass blocked blood vessels in the heart,"These dollar amounts show the average cost to the hospital for a blocked blood vessel bypass surgery. A higher average cost to the hospital does not always mean a hospital provides better quality care. Your costs (what you pay yourself) will also depend on details of your surgery, and insurance coverage. Rememeber, higher cost do not always mean higher quality.",1,,N,N/A,L,mcmc,100,Provider,0.0006,0,60,51369,0.0012,0,0,"These dollar amounts show the average cost to the hospital for a blocked blood vessel bypass surgery. A higher average cost to the hospital does not always mean a hospital provides better quality care. Your costs (what you pay yourself) will also depend on details of your surgery, and insurance coverage. Rememeber, higher cost do not always mean higher quality.",Average cost to the hospital for blocked blood vessel in the heart bypass surgery
